{
  "operation": {
    "name": "project.archive",
    "version": "0.1.0",
    "stability": "draft"
  },
  "mode": "plan",
  "status": "requires_approval",
  "mutates": false,
  "project": {
    "name": "synthetic-project",
    "ref_policy": "opaque_ref"
  },
  "approval": {
    "required": true,
    "classes": ["repo_mutation"],
    "reason": "Lifecycle operations require approval before filesystem or git mutation."
  },
  "side_effects": ["filesystem.write", "git.write"],
  "adapter_capabilities": ["project.resolve", "filesystem.write_project_files", "git.inspect_status", "git.write_branch", "approval.request"],
  "preview": [
    {
      "kind": "filesystem.write",
      "path_policy": "category_only",
      "summary": "Mark the project archived without deleting data."
    },
    {
      "kind": "git.write",
      "path_policy": "category_only",
      "summary": "Prepare branch and commit for archive metadata."
    }
  ],
  "verification": [
    {
      "kind": "operation_plan",
      "description": "Generate and review an operation plan for project.archive."
    },
    {
      "kind": "approval_gate",
      "description": "Require local approval before write-capable adapter execution."
    },
    {
      "kind": "schema",
      "description": "Validate lifecycle result shape before execution handoff."
    }
  ],
  "warnings": [
    "This preview does not perform filesystem or git mutations.",
    "Apply-mode execution is blocked until write-capable local adapters and approval gates exist."
  ],
  "reason": "Synthetic lifecycle preview fixture."
}
